,name,price,deskripsi,isi_deksripsi
562,My Baby Minyak Telon Plus Long Protection 60 ml,Rp19.400 - Rp35.200,Deskripsi**Indikasi Umum**Komposisi**Dosis**Aturan Pakai**Perhatian**Kontra Indikasi**Golongan Produk**Kemasan**Manufaktur**No. Registrasi,"My baby minyak telon plus long protection dengan minyak sereh dan chamomile dapat membantu meredakan perut kembung dan masuk angin, memberikan rasa hangat dan nyaman pada tubuh bayi, membantu menghindari bayi dari gigitan serangga dan nyamuk selama 12 jam**Membantu meredakan perut kembung dan masuk angin, memberikan rasa hangat dan nyaman pada tubuh bayi, membantu menghindari bayi dari gigitan serangga dan nyamuk selama 12 jam**Oleum citronellae minyak sereh 2.1%, oleum chamomilae 2.5%, oleum graminis citrati 1.5%, oleum anisi 6%, oleum cajuputi 57.9%, oleum cocos 30%**Sesuai kebutuhan**Oleskan 5-10 tetes pada dada, perut, pinggang dan telapak kaki. Dapat dipakai setiap saat, terutama sehabis mandi dan bila udara dingin**Obat Luar, Simpan di tempat yang sejuk dibawah 30 C**Hipersensitif**Herbal**Dus, Botol @ 60 ml**Tempo Natural Products**BPOM: TR152689301"
563,My Baby Minyak Telon Plus Long Protection 90 ml,Rp21.600 - Rp36.800,Deskripsi**Indikasi Umum**Komposisi**Dosis**Aturan Pakai**Perhatian**Kontra Indikasi**Golongan Produk**Kemasan**Manufaktur**No. Registrasi,"My baby minyak telon plus long protection dengan minyak sereh dan chamomile dapat membantu meredakan perut kembung dan masuk angin, memberikan rasa hangat dan nyaman pada tubuh bayi, membantu menghindari bayi dari gigitan serangga dan nyamuk selama 12 jam**Membantu meredakan perut kembung dan masuk angin, memberikan rasa hangat dan nyaman pada tubuh bayi, membantu menghindari bayi dari gigitan serangga dan nyamuk selama 12 jam**Oleum citronellae minyak sereh 2.1%, oleum chamomilae 2.5%, oleum graminis citrati 1.5%, oleum anisi 6%, oleum cajuputi 57.9%, oleum cocos 30%**Sesuai kebutuhan**Oleskan 5-10 tetes pada dada, perut, pinggang dan telapak kaki. Dapat dipakai setiap saat, terutama sehabis mandi dan bila udara dingin**Obat Luar, Simpan di tempat yang sejuk dibawah 30 C**Hipersensitif**Herbal**Dus, Botol @ 90 ml**Tempo Natural Products**BPOM: TR152689301"
564,PUREBB Warming Oil 60 ml,Rp33.300 - Rp45.800,Deskripsi**Indikasi Umum**Komposisi**Dosis**Aturan Pakai**Golongan Produk**Kemasan**Manufaktur**No. Registrasi,"PUREBB WARMING OIL 60 ML berasal dari Exclusive Essential Oil yang diformulasikan secara seimbang agar tidak mengiritasi kulit si kecil, berfungsi untuk menghangatkan dan melindungi bayi dari gigitan nyamuk/serangga dengan aroma yang menyenangkan.**- Membantu memberikan rasa hangat pada tubuh bayi - Membantu meredakan perut kembung - Membantu menghindari gigitan nyamuk**Tiap botol mengandung: Oleum Cajuputi (Minyak Kayuputih), Oleum anisi (Minyak adas manis), Oleum landule (MInyak Lavender), Oleum cocos (Minyak Kelapa)**Sesuai kebutuhan**Usapkan secara merata pada perut, punggung dan dada termasuk bagian tubuh yang mudah digigit nyamuk seperti leher, tangan dan kaki setiap kali sehabis mandi.**Herbal**Botol @ 60 ML**Delta Atsiri Prima**BPOM: TR175604351"
565,Pigeon Baby Oil Chamomile 100 ml,Rp14.300 - Rp34.700,Indikasi Umum**Dosis**Golongan Produk**Kemasan**Manufaktur**No. Registrasi,"Memberikan kelembaban ekstra untuk kulit bayi yang kering, membuat kulit bayi menjadi lembut dan halus, serta membantu menstimulasi sirkulasi darah.**Sesuai kebutuhan, bisa untuk pijat**Produk Konsumen**Botol @ 100 ml**Pigeon Corporation**BPOM: NA18110101425"
566,Safe Care 3 Point Oil Telon Aromatherapy 30 ml,Rp19.300 - Rp46.900,Indikasi Umum**Komposisi**Dosis**Aturan Pakai**Golongan Produk**Kemasan**Manufaktur**No. Registrasi,"Membantu meredakan perut kembung, membantu memberikan rasa hangat pada tubuh bayi, membantu melembutkan kulit bayi, dan membantu menghindari gigitan nyamuk.**Oleum Eucalypti 13%, Oleum Cajuputi 8%, Oleum Foeniculi 12%, Oleum Cocos 15%, Oleum Lavandulae 2%, Oleum Jojoba 27%, Oleum Europaea 23%**Sesuai kebutuhan dan tidak dikonsumsi berlebihan**Oleskan secukupnya pada bagian yang diperlukan.**Herbal**Botol @ 30 g**Surabaya Indah Permai**BPOM: TR163698481"
567,Safe Care Minyak Kayu Putih Plus Aromatherapy 10 ml,Rp15.000 - Rp45.800,Deskripsi**Indikasi Umum**Komposisi**Aturan Pakai**Perhatian**Golongan Produk**Kemasan**Manufaktur**No. Registrasi,"SAFE CARE MINYAK KAYU PUTIH PLUS AROMATHERAPY adalah minyak angin yang digunakan untuk meredakan perut kembung, pusing, masuk angin dan mabuk perjalanan. Produk ini mengandung Cajuput Oil (minyak kayu putih) yang memberikan efek hangat pada tubuh, oleum jojoba sebagai anti iritasi bila dipakai berulang, serta menthol dan camphor yang memberikan efek relaxasasi.**Membantu meredakan sakit perut, perut kembung, gejala masuk angin, menghangatkan badan, dan mencegah gigitan nyamuk hingga 4 jam.**Oleum Eucalypti 49%, Oleum Cajuputi 37%, Menthol 0.4%, Camphor 1.5%, Oleum Jojoba 4%, Oleum Geranii 0,7%, Oleum Cocos ad 100%.**Gosokkan secukupnya pada kening, dada, hidung, atau pada bagian yang sakit lainnya.**Hanya untuk penggunaan luar. Hindari kontak dengan mata, kulit yang luka ataupun iritasi. Jauhkan dari jangkauan anak-anak.**Produk Konsumen**Dus, Botol @ 10 ml**Surabaya Indah Permai**BPOM: QD173615091"
568,Safe Care Minyak Kayu Putih Plus Aromatherapy 5 ml,Rp7.500 - Rp13.200,Golongan Produk**Kemasan**Manufaktur,"Produk Konsumen**Dus, Botol @ 5 ml**Surabaya Indah Permai"
569,Scorpio Minyak Kayu Putih 60 ml,Rp12.100 - Rp19.500,Golongan Produk**Kemasan**Manufaktur,Herbal**Botol 60 ml**Gemilangsakti Farmindo
570,Sebamed Baby Skin Care Oil 150 ml,Rp86.700 - Rp113.800,Golongan Produk**Kemasan**Manufaktur**No. Registrasi,"Produk Konsumen**Dus, Botol @ 150 ml**Sebapharma**BPOM: NC16120101806"
571,Sidola Minyak Kayu Putih 15 ml,Rp6.800 - Rp13.900,Golongan Produk**Kemasan**Manufaktur**No. Registrasi,Herbal**Botol @ 15 ml**Sidola**BPOM: TR073670621
572,Sidola Minyak Kayu Putih 30 ml,Rp17.800 - Rp19.500,Komposisi**Dosis**Aturan Pakai**Perhatian**Golongan Produk**Kemasan**Manufaktur**No. Registrasi,Ekstrak daun dan ranting kayu putih**Gunakan sesuai kebutuhan**Oleskan pada bagian badan yang sakit**Hanya untuk pemakaian luar**Herbal**Botol @ 30 ml**Sidola**BPOM: TR073670621
573,Sidola Minyak Kayu Putih 60 ml,Rp35.300 - Rp36.500,Deskripsi**Komposisi**Dosis**Aturan Pakai**Perhatian**Golongan Produk**Kemasan**Manufaktur**No. Registrasi,"SIDOLA MINYAK KAYU PUTIH 60 ML digunakan untuk membantu meredakan sakit perut, perut kembung, mual, masuk angin serta gatal-gatal akibat gigitan serangga. Dapat juga digunakan sebagai aromaterapi dan memberikan rasa hangat pada tubuh.**Ekstrak daun dan ranting kayu putih**Gunakan sesuai kebutuhan**Oleskan pada bagian badan yang sakit**Hanya untuk pemakaian luar**Herbal**Botol @ 60 ml**Sidola**BPOM: TR073670621"
574,Sidola Minyak Telon 100 ml,Rp24.700 - Rp50.800,Golongan Produk**Kemasan**Manufaktur**No. Registrasi,Herbal**Botol @ 100 ml**Sidola**BPOM: TR023616151
575,Sidola Minyak Telon 30 ml,Rp8.000 - Rp16.500,Golongan Produk**Kemasan**Manufaktur**No. Registrasi,Herbal**Botol @ 30 ml**Sidola**BPOM: TR023616151
576,Sleek Baby Telon Oil 30 ml,Rp12.100 - Rp18.200,Golongan Produk**Kemasan**Manufaktur,Produk Konsumen**Botol @ 30 ml**Kino group
577,Sleek Baby Telon Oil 70 ml,Rp23.800 - Rp34.900,Golongan Produk**Kemasan**Manufaktur,Produk Konsumen**Botol @ 70 ml**Kino group
578,Tanqa Essential Minyak Telon Plus 100 ml,Rp31.100 - Rp37.800,Golongan Produk**Kemasan**Manufaktur,Produk Konsumen**Botol @ 100 ml**Tanqa Putra Jaya
579,Tresnojoyo Minyak Telon 100 ml,Rp21.900 - Rp40.500,Deskripsi**Indikasi Umum**Komposisi**Dosis**Aturan Pakai**Perhatian**Kontra Indikasi**Efek Samping**Golongan Produk**Kemasan**Manufaktur**No. Registrasi,"Tresnojoyo Minyak Telon diformulasikan secara khusus dari bahan-bahan alami, untuk memberikan kelembutan, dan aroma khas, sehingga tidak menyebabkan iritasi pada kulit bayi yang sensitif. Minyak Telon Tresnojoyo, lembut dan tidak lengket sehingga cepat meresap pada kulit, membantu mengatasi perut kembung, memperlancar sistem pernafasan, dan memberikan kehangatan yang pas.**Meredakan perut kembung / masuk angin, memberi rasa hangat dan nyaman pada tubuh bayi, mengindari dari gigitan nyamuk bahkan nyamuk demam berdarah, dan melembabkan kulit agar tidak kering**Oleum Foeniculi 16%, Oleum Cocos 22%, Oleum Cajuputi 62%**Oleskan 5-10 tetes Telon Herbal Pluss pada dada, perut, pinggang dan telapak kaki, dapat dipakai setiap saat, terutama sehabis mandi dan bila udara dingin.**Oleskan pada bagian yang dibutuhkan secara merata**Simpan ditempat yang kering dan terhindar dari sinar matahari langsung.**Hipersensitif terhadap salah satu kandungan**-**Produk Konsumen**Dus, Botol @ 100 ml**Tresno Joyo**BPOM: TR123665851"
580,Tresnojoyo Minyak Telon 30 ml,Rp5.500 - Rp15.000,Indikasi Umum**Komposisi**Golongan Produk**Kemasan**Manufaktur**No. Registrasi,"Meredakan perut kembung / masuk angin, memberi rasa hangat dan nyaman pada tubuh bayi, mengindari dari gigitan nyamuk bahkan nyamuk demam berdarah, dan melembabkan kulit agar tidak kering**Oleum Cajuputi 60.5%, Oleum Anisi 16%, Oleum Citronela 2.5%, Oleum Jojoba 2%, Oleum Cocos 19%**Produk Konsumen**Botol @ 30 ml**Tresno Joyo**BPOM: TR123665851"
581,Tresnojoyo Minyak Telon 60 ml,Rp11.500 - Rp29.900,Deskripsi**Indikasi Umum**Komposisi**Dosis**Aturan Pakai**Perhatian**Kontra Indikasi**Efek Samping**Golongan Produk**Kemasan**Manufaktur**No. Registrasi,"Tresnojoyo Minyak Telon digunakan untuk membantu meredakan perut kembung/ masuk angin, memberi rasa hangat dan nyaman pada tubuh bayi, menghindari dari gigitan nyamuk dan melembabkan kulit agar tidak kering.**Membantu meredakan perut kembung/ masuk angin, memberi rasa hangat dan nyaman pada tubuh bayi, menghindari dari gigitan nyamuk dan melembabkan kulit agar tidak kering.**Oleum Cajuputi 60.5%, Oleum Anisi 16%, Oleum Citronela 2.5%, Oleum Jojoba 2%, Oleum Cocos 19%**Oleskan 5-10 tetes Telon Herbal Pluss pada dada, perut, pinggang dan telapak kaki, dapat dipakai setiap saat, terutama sehabis mandi dan bila udara dingin.**Dioleskan merata pada tubuh setelah mandi atau jika perlu.**Simpan di tempat kering, terlindung dari sinar matahari langsung, pada suhu dibawah 30 C**-**-**Herbal**Dus, Botol @ 60 ml**Ultra Sakti**BPOM: TR123665851"
582,Tresnojoyo Telon Herbal Plus Citronella 100 ml,Rp12.100 - Rp36.300,Deskripsi**Indikasi Umum**Komposisi**Dosis**Aturan Pakai**Perhatian**Golongan Produk**Kemasan**Manufaktur**No. Registrasi,"Tresnojoyo Minyak Telon Herbal PLus Citronella merupakan minyak telon dengan minyak sereh dan mintak jojoba yang digunakan untuk membantu meredakan perut kembung/ masuk angin, memberi rasa hangat dan nyaman pada tubuh bayi, menghindari dari gigitan nyamuk dan melembabkan kulit agar tidak kering.**Membantu meredakan perut kembung/ masuk angin, memberi rasa hangat dan nyaman pada tubuh bayi, menghindari dari gigitan nyamuk dan melembabkan kulit agar tidak kering.**Oleum Cajuputi 60.5%, Oleum Anisi 16%, Oleum Citronela 2.5%, Oleum Jojoba 2%, Oleum Cocos 19%**Oleskan 5-10 tetes Telon Herbal Pluss pada dada, perut, pinggang dan telapak kaki, dapat dipakai setiap saat, terutama sehabis mandi dan bila udara dingin.**Dioleskan merata pada tubuh setelah mandi atau jika perlu.**Simpan di tempat kering, terlindung dari sinar matahari langsung, pada suhu dibawah 30 C**Herbal**Dus, Botol @ 100 ml**Ultra Sakti**BPOM: TR123665861"
583,Tresnojoyo Telon Herbal Plus Lavender 60 ml,Rp12.600 - Rp22.500,Deskripsi**Indikasi Umum**Komposisi**Dosis**Aturan Pakai**Perhatian**Kontra Indikasi**Efek Samping**Golongan Produk**Kemasan**Manufaktur,"-**Memberikan kehangatan untuk buah hati dengan keharuman khas bayi.**Oleum Foeniculi 16 %, Oleum cocos 22 %, Oleum Cajuputi 62 %**Oleskan 5-10 tetes Telon Herbal Pluss pada dada, perut, pinggang dan telapak kaki, dapat dipakai setiap saat, terutama sehabis mandi dan bila udara dingin.**Dioleskan merata pada tubuh setelah mandi atau jika perlu.**Hanya untuk penggunaan luar**-**-**Produk Konsumen**Liquid 60 ml X 1**Tresno Joyo"
584,Yummy Bites Kiddy Extra Virgin Olive Oil 250 ml,Rp67.000 - Rp77.800,Golongan Produk**Kemasan**Manufaktur,Produk Konsumen**Botol @ 250 ml**None
585,Zwitsal Baby Minyak Telon Natural 100 ml,Rp20.600 - Rp53.400,Golongan Produk**Kemasan**Manufaktur,Produk Konsumen**Botol @ 100 ml**Unilever
586,Zwitsal Baby Minyak Telon Natural 60 ml,Rp17.000 - Rp30.700,Golongan Produk**Kemasan**Manufaktur**No. Registrasi,Herbal**Botol @ 60 ml**Merpati Mahardika**BPOM: TR093604331
587,Zwitsal Baby Oil Natural 100ml,Rp15.400 - Rp32.000,Indikasi Umum**Golongan Produk**Kemasan**Manufaktur,melembutkan kulit**Produk Konsumen**Botol @ 100 ml**Unilever
588,Baby Happy Pants L 28 Pieces,Rp47.900 - Rp70.800,Golongan Produk**Kemasan**Manufaktur,Produk Konsumen**Pack @ 30 pieces**None
589,Baby Happy Pants M 32 Pieces,Rp46.200 - Rp70.800,Golongan Produk**Kemasan**Manufaktur,Produk Konsumen**Pack @ 34 pieces**Wings Indonesia
590,Baby Happy Pants XL 26 Pieces,Rp51.900 - Rp75.600,Golongan Produk**Kemasan**Manufaktur,Produk Konsumen**Pack @ 26 pieces**Wings Indonesia
591,Baby Safe Underpad 10 Pieces,Rp42.500 - Rp59.400,Golongan Produk**Kemasan**Manufaktur,Produk Konsumen**Pack isi 10**Baby Safe
592,Cheris Cool Pants L 20 Pieces,Rp35.400 - Rp44.000,Golongan Produk**Manufaktur,Produk Konsumen**Anerle
593,Cheris Cool Pants M 20 Pieces,Rp17.600 - Rp39.600,Golongan Produk**Kemasan**Manufaktur,Produk Konsumen**Pack 20 pieces**Anerle
594,Cheris Pants M 32 Pieces,Rp48.600 - Rp61.600,Golongan Produk**Kemasan**Manufaktur,Produk Konsumen**Pack 32 pieces**Anerle
595,Cheris Pants S 36 Pieces,Rp45.400 - Rp55.100,Golongan Produk**Kemasan**Manufaktur,Produk Konsumen**Pack 36 pieces**Anerle
596,Cheris Pants XL 24 Pieces,Rp47.600 - Rp57.300,Golongan Produk**Kemasan**Manufaktur,Produk Konsumen**Pack 24 pieces**Anerle
597,Cheris Pants XXL 22 Pieces,Rp47.600 - Rp62.400,Golongan Produk**Kemasan**Manufaktur,Produk Konsumen**Pack 22 pieces**Anerle
598,Drypers Pants L 18,Rp29.100 - Rp49.700,Deskripsi**Indikasi Umum**Dosis**Aturan Pakai**Golongan Produk**Kemasan**Manufaktur**No. Registrasi,"Drypers Pants merupakan popok celana untuk Bayi dengan berat badan 9-14 Kilogram. Memiliki Aksi Triple Core yang sangat bagus sehingga mampu bertahan hingga 12 jam dan menjaga kulit bayi tetap kering dan terhindar dari iritasi, juga memiliki Double Leak Guard yang mencegah kebocoran dari samping. Di produksi dengan teknologi Smart FIT yang membalut secara keseluruhan dari 4 sisi dengan elastis halus yang menyesuaikan gerak sikecil dan tidak meninggalkan bekas merah pada kulit sehingga membuat bayi tetap nyaman dalam beraktifitas.**Sebagai popok sekali pakai untuk bayi dengan berat badan 9-14 Kilogram**Sesuai kebutuhan**1. Siapkan popok yang baru. 2. Lepaskan popok celana bekas dengan cara menurunkan popok ke bawah atau sobek bagian sampingnya. 3. Bersihkan area pantat. 4. Pakaikan popok baru dengan cara memasukkan kedua tangan ibu ke lubang kaki popok dan masukkan kaki bayi melalui lubang lalu tarik popok hingga sebatas perut bayi. 5. Rapikan sisi karet dan pelindung samping dengan menggunakan jari untuk merapikan sisi karet dan pelindung samping popok untuk mencegah kebocoran**Alat Kesehatan & Medis Habis Pakai**Pack @ 18 pieces**Vinda Internasional Indonesia**Kemenkes RI: PKD 20402811311"
599,Drypers Pants L 28,Rp47.600 - Rp55.000,Golongan Produk**Kemasan**Manufaktur,Produk Konsumen**Pack 28 pieces**None
600,Drypers Wee Wee Dry S 22 Pads,Rp59.200 - Rp59.300,Deskripsi**Indikasi Umum**Dosis**Golongan Produk**Kemasan**Manufaktur**No. Registrasi,"Drypers Wee Wee Dry dilengkapi dengan SpeedyDRY Layer dengan cepat menyerap dan mendistribusikan urin, menjaga lapisan atas tetap kering dan mengurangi kontak dengan urin sehingga kulit bayi tetap kering dan nyaman. Dilengkapi dengan Tali Pinggang yang Dapat Merenggang dan Pelindung Kebocoran. Flexi-Tape yang dapat disesuaikan pada posisi yang paling pas untuk mencegah kebocoran. Panduan ini juga memberi tahu ibu dan ayah jika sudah waktunya bayi menggunakan ke ukuran berikutnya.**Sebagai popok sekali pakai untuk bayi dengan berat badan 3-7 Kilogram**Sesuai kebutuhan**Alat Kesehatan & Medis Habis Pakai**Pack @ 22 Pads**PIERROT**Kemenkes RI: PKD 20402711269"
601,Fitti Day Pants XL 18 Pieces,Rp47.600 - Rp53.500,Golongan Produk**Kemasan**Manufaktur,Produk Konsumen**Pack @ 18 pieces**DSG Surya Mas Indonesia
602,Fitti Dry XL 34 Pieces,Rp61.700 - Rp67.100,Golongan Produk**Kemasan**Manufaktur,Produk Konsumen**Pack 34 pieces**None
603,Goon Dry L 32 Pieces,Rp90.500 - Rp98.500,Golongan Produk**Kemasan**Manufaktur,Produk Konsumen**Pack 32 pieces**Unilever
604,Goon Dry M 38 Pieces,Rp85.400 - Rp98.500,Golongan Produk**Kemasan**Manufaktur,Produk Konsumen**Pack 38 pieces**Unilever
605,Goon Dry S 44 Pieces,Rp85.900 - Rp102.600,Golongan Produk**Kemasan**Manufaktur,Produk Konsumen**Pack 44 pieces**Unilever
606,Goon Pants M 32 Pieces,Rp64.300 - Rp91.900,Golongan Produk**Kemasan**Manufaktur,Produk Konsumen**Pack 32 Pieces**Unilever
607,Goon Pants XL 44 Pieces,Rp114.500 - Rp155.600,Golongan Produk**Kemasan**Manufaktur,Produk Konsumen**Pack 44 Pieces**Unilever
608,Goon Pants XXL 19+2 Pieces,Rp64.300 - Rp91.900,Golongan Produk**Kemasan**Manufaktur,Produk Konsumen**Pack 19 + 2 Pieces**Unilever
609,Goon Pants XXL 36 Pieces,Rp97.200 - Rp155.600,Golongan Produk**Kemasan**Manufaktur,Produk Konsumen**Pack 36 Pieces**Unilever
610,Goon Smile Night Pants M 34 Pieces,Rp39.500 - Rp59.400,Golongan Produk**Kemasan**Manufaktur,Produk Konsumen**Pack 34 Pieces**Unilever
611,Happy Nappy Pants L 30 Pieces,Rp42.700 - Rp62.400,Golongan Produk**Kemasan**Manufaktur,Produk Konsumen**Pack 30 Pieces**Softex Indonesia
612,Happy Nappy Pants M 34 Pieces,Rp42.700 - Rp62.900,Golongan Produk**Kemasan**Manufaktur,Produk Konsumen**Pack 34 Pieces**Softex Indonesia
613,Happy Nappy Pants S 40 Pieces,Rp43.900 - Rp56.800,Golongan Produk**Kemasan**Manufaktur,Produk Konsumen**Pack 40 Pieces**Softex Indonesia
614,Happy Nappy Pants XL 44 Pieces,Rp72.400 - Rp81.400,Golongan Produk**Kemasan**Manufaktur,Produk Konsumen**Pack 44 Pieces**Softex Indonesia
615,Happy Nappy Pants XXL 36 Pieces,Rp72.100 - Rp90.200,Golongan Produk**Kemasan**Manufaktur,Produk Konsumen**Pack 36 Pieces**Softex Indonesia
616,Mama Mia Active Dry Pants M 18 Pieces,Rp26.300 - Rp28.600,Golongan Produk**Kemasan**Manufaktur,Produk Konsumen**Pack 18 pieces**Aman Indah Makmur
617,Mama Mia Active Dry Pants XL 18 Pieces,Rp33.500 - Rp45.500,Golongan Produk**Kemasan**Manufaktur,Produk Konsumen**Pack 18 pieces**Aman Indah Makmur
618,Mama Mia Pants L 30 Pieces,Rp37.400 - Rp54.000,Golongan Produk**Kemasan**Manufaktur,Produk Konsumen**Pack 30 pieces**Aman Indah Makmur
619,Mama Mia Pants XL 26 Pieces,Rp32.400 - Rp51.900,Golongan Produk**Kemasan**Manufaktur,Produk Konsumen**Pack 26 pieces**Aman Indah Makmur
620,Mamy Love Pants M 1,Rp2.000 - Rp3.400,Golongan Produk**Kemasan**Manufaktur,Produk Konsumen**Pack isi 1**None
621,Mamy Love Pants M 9 Pieces,Rp14.300 - Rp25.300,Golongan Produk**Kemasan**Manufaktur,Produk Konsumen**Pack isi 9**Mitra Bersama Jaya
622,Mamy Love Pants XL 1,Rp2.000 - Rp4.200,Golongan Produk**Kemasan**Manufaktur,Produk Konsumen**Pack isi 1**None
623,Mamy Love Pants XL 40 Pieces,Rp61.600 - Rp83.600,Golongan Produk**Kemasan**Manufaktur,Produk Konsumen**Pack 40 pieces**Mitra Bersama Jaya
624,Mamy Poko Extra Dry M 56 Pieces,Rp96.200 - Rp124.200,Golongan Produk**Kemasan**Manufaktur,Produk Konsumen**Pack 56 pieces**Unicharm
625,Mamy Poko Extra Dry New Born 14 Pieces,Rp32.500 - Rp66.000,Indikasi Umum**Golongan Produk**Kemasan**Manufaktur,Pampers untuk balita**Produk Konsumen**Pack 14 pads**Unicharm
626,Mamy Poko Extra Dry S 50 Pieces,Rp85.100 - Rp121.000,Golongan Produk**Kemasan**Manufaktur,Produk Konsumen**Pack 50 pieces**Unicharm
627,Mamy Poko Extra Dry S 80 Pieces,Rp136.900 - Rp150.700,Golongan Produk**Kemasan**Manufaktur,Produk Konsumen**Pack 80 pieces**Unicharm
628,Mamy Poko Junior Night Pants Boys XXL 28 Pieces,Rp104.500 - Rp167.200,Golongan Produk**Kemasan**Manufaktur,Produk Konsumen**Pack 28 pieces**Unicharm
629,Mamy Poko Junior Night Pants Boys Xxxl 24 Pieces,Rp145.800 - Rp182.500,Golongan Produk**Kemasan**Manufaktur,Produk Konsumen**Pack 24 pieces**Unicharm
630,Mamy Poko Junior Night Pants Girls XXL 28 Pieces,Rp106.700 - Rp165.000,Golongan Produk**Kemasan**Manufaktur,Produk Konsumen**Pack 28 pieces**Unicharm
631,Mamy Poko Junior Night Pants Girls Xxxl 24 Pieces,Rp147.000 - Rp236.400,Golongan Produk**Kemasan**Manufaktur,Produk Konsumen**Pack 24 pieces**Unicharm
632,Mamy Poko Pants Air Fit Girls XL 38 Pieces,Rp161.800 - Rp200.600,Golongan Produk**Manufaktur,Alat Kesehatan & Medis Habis Pakai**Unicharm
633,Mamy Poko Pants Extra Dry M 32 Pieces,Rp63.000 - Rp79.800,Deskripsi**Indikasi Umum**Dosis**Aturan Pakai**Perhatian**Efek Samping**Golongan Produk**Kemasan**Manufaktur,"MAMY POKO PANTS EXTRA DRY M merupakan popok bayi tipe celana yang berukuran M untuk bayi yang memiliki berat badan sekitar 7-12 kg yang memiliki daya serap banyak dan cepat sehingga mencegah bocor dan pantat bayi tetap kering sehingga bayi tidur nyenyak semalaman.**Popok bayi tipe celana yang berukuran M untuk bayi yang memiliki berat badan sekitar 7-12 kg yang memiliki daya serap banyak dan cepat sehingga mencegah bocor dan pantat bayi tetap kering sehingga bayi tidur nyenyak semalaman.**Sesuai kebutuhan**1. Siapkan popok yang baru. 2. Lepaskan popok celana bekas dengan cara menurunkan popok ke bawah atau sobek bagian sampingnya. 3. Bersihkan area pantat. 4. Pakaikan popok baru dengan cara memasukkan kedua tangan ibu ke lubang kaki popok dan masukkan kaki bayi melalui lubang lalu tarik popok hingga sebatas perut bayi. 5. Rapikan sisi karet dan pelindung samping dengan menggunakan jari untuk merapikan sisi karet dan pelindung samping popok untuk mencegah kebocoran**Simpanlah di tempat yang sejuk dan kering. Jauhkan dari sinar matahari langsung. Apabila terjadi iritasi pada kulit bayi, hentikan pemakaian dan konsultasikan ke dokter**Reaksi efek samping yang mungkin terjadi yaitu diantaranya kulit kemerahan, ruam popok yang dapat disertai pula dengan kulit yang leceh dan perih saat disentuh dan munculnya infeksi jamur yang biasanya disebabkan oleh pemakaian popok lembap terlalu lama**Produk Konsumen**Pack @ 32 Pieces**Unicharm"
634,Mamy Poko Pants Extra Dry XL 7 Pieces,Rp7.700 - Rp16.400,Golongan Produk**Kemasan**Manufaktur,Produk Konsumen**Pack @ 7 pieces**Unicharm
635,Mamy Poko Pants Extra Dry XXL 6 Pieces,Rp17.400 - Rp25.600,Golongan Produk**Kemasan**Manufaktur,Produk Konsumen**Pack @ 6 pieces**Unicharm
636,Mamy Poko Pants Extra Soft Girls XL 24 Pieces,Rp81.000 - Rp113.400,Golongan Produk**Kemasan**Manufaktur,Produk Konsumen**Pack 24 pieces**Unicharm
637,Mamy Poko Pants Royal Soft Boys L 34 Pieces,Rp110.400 - Rp133.500,Golongan Produk**Kemasan**Manufaktur,Produk Konsumen**Pack @ 34 pieces**Unicharm
638,Mamy Poko Pants Royal Soft Boys XL 30 Pieces,Rp98.900 - Rp142.600,Golongan Produk**Kemasan**Manufaktur,Produk Konsumen**Pack @ 30 pieces**Unicharm
639,Mamy Poko Pants Royal Soft Boys XXL 24 Pieces,Rp110.300 - Rp142.600,Deskripsi**Indikasi Umum**Dosis**Aturan Pakai**Perhatian**Efek Samping**Golongan Produk**Kemasan**Manufaktur,"MAMY POKO PANTS ROYAL SOFT BOYS XXL merupakan popok bayi laki-laki tipe celana dengan ukuran XXL untuk bayi dengan berat badan sekitar 15-25 kg yang memiliki Soft Cotton Belt, yaitu pelindung pinggang yang lembut dan pas, cocok untuk si kecil yang aktif bergerak dan memiliki Narrow crotch, yaiitu pas di selangkangan dan berbentuk ramping.**Popok bayi laki-laki tipe celana dengan ukuran XXL untuk bayi dengan berat badan sekitar 15-25 kg yang memiliki Soft Cotton Belt, yaitu pelindung pinggang yang lembut dan pas, cocok untuk si kecil yang aktif bergerak dan memiliki Narrow crotch, yaiitu pas di selangkangan dan berbentuk ramping.**Sesuai kebutuhan**1. Siapkan popok yang baru. 2. Lepaskan popok celana bekas dengan cara menurunkan popok ke bawah atau sobek bagian sampingnya. 3. Bersihkan area pantat. 4. Pakaikan popok baru dengan cara memasukkan kedua tangan ibu ke lubang kaki popok dan masukkan kaki bayi melalui lubang lalu tarik popok hingga sebatas perut bayi. 5. Rapikan sisi karet dan pelindung samping dengan menggunakan jari untuk merapikan sisi karet dan pelindung samping popok untuk mencegah kebocoran**Simpanlah di tempat yang sejuk dan kering. Jauhkan dari sinar matahari langsung. Apabila terjadi iritasi pada kulit bayi, hentikan pemakaian dan konsultasikan ke dokter**Reaksi efek samping yang mungkin terjadi yaitu diantaranya kulit kemerahan, ruam popok yang dapat disertai pula dengan kulit yang leceh dan perih saat disentuh dan munculnya infeksi jamur yang biasanya disebabkan oleh pemakaian popok lembap terlalu lama**Produk Konsumen**Pack @ 24 Pieces**Unicharm"
640,Mamy Poko Pants Royal Soft Gilrs M 42 Pieces,Rp97.200 - Rp142.600,Golongan Produk**Kemasan**Manufaktur,Produk Konsumen**Pack @ 42 pieces**Unicharm
641,Mamy Poko Pants Royal Soft Girls L 34 Pieces,Rp96.200 - Rp138.300,Golongan Produk**Kemasan**Manufaktur,Produk Konsumen**Pack @ 34 pieces**Unicharm
642,Mamy Poko Pants Royal Soft Girls XL 30 Pieces,Rp98.900 - Rp142.600,Golongan Produk**Kemasan**Manufaktur,Produk Konsumen**Pack @ 30 pieces**Unicharm
