,name,price,deskripsi,isi_deksripsi
247,Probaby Bath Anise Oil 100 ml,Rp10.500 - Rp20.900,Deskripsi**Indikasi Umum**Golongan Produk**Kemasan**Manufaktur**No. Registrasi,PROBABY BATH ANISE OIL 100 ML merupakan Sabun Mandi Bayi dengan minyak essensial yang dapat membersihkan dan menghangatkan tubuh bayi. Dengan aroma yang segar dan ceria**Sebagai sabun mandi bayi yang dapat mlembutkn dan menghangatkan tubuh bayi**Produk Konsumen**Botol @ 100 ML**Etercon Pharma**BPOM: NA18200701135
248,Probaby Bath Cheerful Giggle 100 ml,Rp8.800 - Rp13.600,Golongan Produk**Kemasan**Manufaktur**No. Registrasi,Produk Konsumen**Botol 100 ml**Etercon Pharma**BPOM: NA18200700919
249,Probaby Bath Silky Cuddle 100 ml,Rp8.800 - Rp17.600,Golongan Produk**Kemasan**Manufaktur**No. Registrasi,Produk Konsumen**Botol 100 ml**Etercon Pharma**BPOM: NA18200700920
250,Probaby Cologne Cheerful Giggle 100 ml,Rp11.000 - Rp20.200,Deskripsi**Indikasi Umum**Dosis**Perhatian**Golongan Produk**Kemasan**Manufaktur**No. Registrasi,PROBABY COLOGNE CHEERFUL GIGGLE merupakan parfum bayi dengan bahan-bahan natural dan pH yang seimbang dengan aroma yang segar dan ceria**Parfum bayi dengan bahan-bahan natural dan pH yang seimbang dengan aroma yang segar dan ceria**Sesuai kebutuhan**Hanya untuk pemakaian luar. Jauhkan dari jangkauan anak-anak**Produk Konsumen**Botol @ 100 ml**Etercon Pharma**BPOM: NA18200600697
251,Probaby Cologne Silky Cuddle 100 ml,Rp11.000 - Rp19.800,Golongan Produk**Kemasan**Manufaktur**No. Registrasi,Produk Konsumen**Botol 100 ml**Etercon Pharma**BPOM: NA18200600696
252,Probaby Shampoo Silky Cuddle 100 ml,Rp8.800 - Rp12.200,Golongan Produk**Kemasan**Manufaktur**No. Registrasi,Produk Konsumen**Botol 100 ml**Etercon Pharma**BPOM: NA18201000787
253,Pure Baby Shampoo Freshy 80 ml,Rp20.300 - Rp35.400,Deskripsi**Indikasi Umum**Komposisi**Dosis**Aturan Pakai**Golongan Produk**Kemasan**Manufaktur**No. Registrasi,"PURE BB SHAMPOO FRESHY 80 ML merupakan shampoo untuk membersihkan rambut dan kulit kepala bayi yang di formulasikan secara khusus tanpa mengandung SLS dan sudah teruji Hypoallergenic, lembut dimata dengan pH 5.5. Shampoo bayi ini juga dapat membantu pertumbuhan rambut, melembutkan rambut bayi untuk rambut tampak hitam dan tebal.**Membersihkan rambut bayi, membantu mengurangi resiko terjadinya kulit kering pada kulit bayi.**Ekstrak Seledri, Kelapa & Aloe Vera**Sesuai kebutuhan. Gunakan secara merata pada kepala bayi yang sudah dibasahkan terlebih dahulu.**Basahkan rambut, usapkan shampoo secara merata pada kepala bayi, bilas hingga bersih dan keringkan.**Produk Konsumen**Botol @80 ml**Etercon Pharma**BPOM : NA18211001077"
254,Pure Kids Hair Detangler Amazing Apple 200 ml,Rp51.600 - Rp73.700,Golongan Produk**Kemasan**Manufaktur**No. Registrasi,Produk Konsumen**botol @ 200 ml**Novell Pharmaceutical Laboratories**BPOM: NA18211001705
255,Pure Kids Hair Detangler Amazing Floral 200 ml,Rp50.800 - Rp75.100,Golongan Produk**Kemasan**Manufaktur**No. Registrasi,Produk Konsumen**Botol @ 200 ml**Novell Pharmaceutical Laboratories**BPOM: NA18211001706
256,Pure Kids Hair Detangler Strawberry 200 ml,Rp44.600 - Rp75.000,Golongan Produk**Kemasan**Manufaktur**No. Registrasi,Produk Konsumen**Botol @ 200 ml**Novell Pharmaceutical Laboratories**BPOM: NA18211001703
257,Pure Kids Tooth Paste Banana 50 g,Rp31.400 - Rp59.000,Golongan Produk**Kemasan**Manufaktur,Produk Konsumen**Tube 50 g**Etercon Pharma
258,Pure Kids Tooth Paste Strawberry 50 g,Rp31.400 - Rp58.200,Deskripsi**Indikasi Umum**Komposisi**Perhatian**Golongan Produk**Kemasan**Manufaktur,Pasta Gigi untuk membersihkan dan merawat gigi tetap sehat dan tidak berlubang yang diformulasikan dengan tanpa SLS tambahan sehingga mencegah iritasi pada mulut dan tanpa Fluoride tambahan untuk mencegah gigi keropos.**Untuk membersihkan dan merawat gigi anak agar tetap sehat dan tidak berlubang**Xylitol dan Silica**Jauhkan Pure Kids Toothpaste dari tempat panas dan sinar matahari langsung**Produk Konsumen**Tube @ 50 g**Etercon Pharma
259,QV Baby Essentials Skincare Trial Kit,Rp51.900 - Rp70.000,Deskripsi**Indikasi Umum**Golongan Produk**Kemasan**Manufaktur**No. Registrasi,"QV Baby Essentials Skincare Trial Kit merupakan produk khusus baby yang terdiri dari: QV Baby Gentle Wash 15 g QV Gentle Wash adalah sabun mandi yang telah teruji secara dermatologis dan tidak mengandung pewangi serta zat yang dapat mengiritasi kulit. Cocok digunakan setiap hari untuk kulit bayi kering atau sensitif QV Baby Barrier 10 g Mengandung Zinc Oxide yang membentuk lapisan penghalang untuk kulit bayi dari deterjen, bahan kimia dan iritan lainnya. Cocok juga digunakan untuk melindungi kulit bayi dan anak dari ruam wajah, biang keringat dan iritasi. Pro-vitamin B5 (Panthenol italic) membantu meningkatkan kemampuan penyebaran krim QV Baby Moisturising 15 g Merupakan krim campuran 5 jenis pelembap yang melembapkan sampai dengan 24 jam yang diperkaya dengan Niacinamide (Vitamin B3). Cocok digunakan setiap hari untuk kondisi kulit kering**QV Baby Essentials Skincare Trial Kit merupakan produk khusus baby yang terdiri dari: QV Baby Gentle Wash 15 g Membantu melembabkan kulit bayi QV Baby Barrier 10g Membantu melindungi kulit bayi yang lembut dan sensitif dari ruam popok QV Baby Moisturising 15g Membantu melindungi kulit dari kekeringan. Diperkaya dengan Niacinamide (Vitamin B3). Moisturising ini tidak berminyak dan mudah menyerap**Produk Konsumen**Tiap Paket QV Baby Essentials Skincare Trial Kit, terdiri dari: 1. QV Baby Gentle Wash: Botol @ 15 g 2. QV Baby Barrier: Tube @ 10 g 3. QV Baby Moisturising: Tube @ 15 g**None**BPOM: NKIT210000511 1. QV Baby Gentle Wash: NB02200700003 2. QV Baby Barrier Cream: NB02200100014 3. QV Baby Moisturising Cream: NB02200100015"
260,QV Baby Gentle Wash Mild Cleansing Botol 250 g,Rp100.700 - Rp202.700,Deskripsi**Indikasi Umum**Komposisi**Dosis**Aturan Pakai**Perhatian**Golongan Produk**Kemasan**Manufaktur**No. Registrasi,"QV Baby Gentle Wash merupakan sabun yang dapat digunakan untuk tubuh dan rambut anak. Sabun ini memiliki pH seimbang, dengan formulasi tidak membuat kering, tanpa tambahan pewangi. Dapat digunakan setiap hari untuk kulit kering atau sensitif.**Sabun yang dapat digunakan untuk tubuh dan rambut anak. Dapat digunakan untuk kulit yang kering dan sensitif**Aqua (Water), Glycerin, Sodium Lauroyl Sarcosinate, Sodium Cocoyl Isethionate, Disodium Cocoamphodiacetate, Acrylates/C10-30 Alkyl Acrylate Crosspolymer, Styrene/Acrylates Copolymer, Lauryl Betaine, Niacinamide, Aminomethyl Propanol, Styrene/Acrylates Copolymer, Methylparaben, Ethylparaben.**Sesuai kebutuhan**Oleskan QV Baby Gentle Wash pada kulit basah dan pijat ringan. Bilas dan keringkan kulit dengan menepuk-nepuk lembut.**Hindari mata. Hanya untuk pemakaian luar. Jika busa terkena mata, basuh dengan air bersih. Jika terjadi iritasi, hentikan penggunaan. Simpan di bawah suhu 30 C.**Produk Konsumen**Botol @ 250 g**Imedco Djaja**BPOM: NB02200700003"
261,QV Baby Moisturising Cream 250 g,Rp161.900 - Rp337.300,Deskripsi**Indikasi Umum**Golongan Produk**Kemasan**Manufaktur**No. Registrasi,QV BABY MOISTURISING CREAM 250 G merupakan Krim dengan campuran 5 jenis pelembab* yang melembabkan sampai dengan 24 jam. Cocok digunakan setiap hari untuk kondisi kulit kering**Membantu melindungi kulit dari kekeringan**Produk Konsumen**Botol pump @ 250 G**EGO Pharmaceutical**BPOM: NB02200100016
262,Reliable Sikat Lidah Press,Rp10.400 - Rp20.300,Golongan Produk**Kemasan**Manufaktur,Produk Konsumen**Pack**Gunon International
263,Sebamed Baby Bubble Bath 1000 ml,Rp373.000 - Rp663.000,Deskripsi**Indikasi Umum**Dosis**Aturan Pakai**Perhatian**Golongan Produk**Kemasan**Manufaktur**No. Registrasi,"Sebamed Baby Bubble Bath merupakan sabun mandi cair ekstra lembut dengan pH 5.5. Sabun ini membersihkan kulit dengan lembut dan menjaga kelembaban kulit. Mengandung Ekstrak Chamomile yang dapat mengurangi dan mencegah kulit bayi dari iritasi.**Sabun mandi untuk bayi yang dapat menjaga kulit bayi bersih dan lembab. Memilliki kandungan ekstrak Chamomile yang dapat membantu mengurangi iritasi kulit.**Sebamed Baby Bubble Bath dapat digunakan setiap kali Anda memandikan bayi Anda. Sabun cair bayi ini juga dapat dipakai menggunakan kain mandi basah di sela-sela waktu waktu mandi.**Basahkan tubuh bayi dengan air hangat, lalu tuangkan Sebamed Baby Bubble Bath di telapak tangan Anda atau kain mandi, kemudian dengan lembut usapkan pada tubuh bayi hingga berbusa, bersihkan dengan air.**Baby Bubble Bath adalah salah satu pembersih tubuh paling ultra-mild dan hypoallergenic, sangat cocok untuk kulit bayi dibandingkan pembersih tubuh untuk dewasa.**Produk Konsumen**Botol @ 100 ml**Sebapharma**BPOM: NC16120701088"
264,Sebamed Baby Bubble Bath 200 ml,Rp145.000,Deskripsi**Indikasi Umum**Dosis**Aturan Pakai**Perhatian**Golongan Produk**Kemasan**Manufaktur**No. Registrasi,"Sebamed Baby Bubble Bath merupakan sabun mandi cair ekstra lembut dengan pH 5.5. Sabun ini membersihkan kulit dengan lembut dan menjaga kelembaban kulit. Mengandung Ekstrak Chamomile yang dapat mengurangi dan mencegah kulit bayi dari iritasi.**Sabun mandi untuk bayi yang dapat menjaga kulit bayi bersih dan lembab. Memilliki kandungan ekstrak Chamomile yang dapat membantu mengurangi iritasi kulit.**Sebamed Baby Bubble Bath dapat digunakan setiap kali Anda memandikan bayi Anda. Sabun cair bayi ini juga dapat dipakai menggunakan kain mandi basah di sela-sela waktu waktu mandi.**Basahkan tubuh bayi dengan air hangat, lalu tuangkan Sebamed Baby Bubble Bath di telapak tangan Anda atau kain mandi, kemudian dengan lembut usapkan pada tubuh bayi hingga berbusa, bersihkan dengan air.**Baby Bubble Bath adalah salah satu pembersih tubuh paling ultra-mild dan hypoallergenic, sangat cocok untuk kulit bayi dibandingkan pembersih tubuh untuk dewasa.**Produk Konsumen**Botol 200 ml**Sebapharma**BPOM: NC16120701088"
265,Sebamed Baby Bubble Bath 500 ml,Rp231.300 - Rp401.300,Deskripsi**Indikasi Umum**Dosis**Aturan Pakai**Golongan Produk**Kemasan**Manufaktur**No. Registrasi,"Sebamed Baby Bubble Bath merupakan sabun mandi cair ekstra lembut dengan pH 5.5. Sabun ini membersihkan kulit dengan lembut dan menjaga kelembaban kulit. Mengandung Ekstrak Chamomile yang dapat mengurangi dan mencegah kulit bayi dari iritasi.**Sabun mandi untuk bayi yang dapat menjaga kulit bayi bersih dan lembab. Memilliki kandungan ekstrak Chamomile yang dapat membantu mengurangi iritasi kulit.**Sebamed Baby Bubble Bath dapat digunakan setiap kali Anda memandikan bayi Anda. Sabun cair bayi ini juga dapat dipakai menggunakan kain mandi basah di sela-sela waktu waktu mandi.**Basahkan tubuh bayi dengan air hangat, lalu tuangkan Sebamed Baby Bubble Bath di telapak tangan Anda atau kain mandi, kemudian dengan lembut usapkan pada tubuh bayi hingga berbusa, bersihkan dengan air.**Produk Konsumen**Botol @ 500 ml**None**BPOM: NC16120701088"
266,Sebamed Baby Care Cream 100 ml,Rp89.700 - Rp190.100,Indikasi Umum**Golongan Produk**Kemasan**Manufaktur,"Sabun yang dapat membersihkan kulit bayi dengan lembut dan menjaganya tetap segar dan menjaga kulit terhindar dari iritasi, gatal, dan biang keringat.**Produk Konsumen**Tube 100 ml**Sebapharma"
267,Sebamed Baby Cream Extra Soft 200 ml,Rp195.100 - Rp290.400,Golongan Produk**Kemasan**Manufaktur**No. Registrasi,"Produk Konsumen**Dus, Tube 200 ml**None**BPOM: NC16120101811"
268,Sebamed Baby Lipbalm 4.8 G,Rp72.000,Golongan Produk**Kemasan**Manufaktur**No. Registrasi,Produk Konsumen**Dus @ case @ 4.8 g**Sebapharma**BPOM: NC16161302988
269,Sebamed Baby Protective Facial Cream 50 ml,Rp297.300 - Rp433.500,Deskripsi**Indikasi Umum**Aturan Pakai**Golongan Produk**Kemasan**Manufaktur**No. Registrasi,"Sebamed Baby Protective Facial Cream merupakan krim pelembab dengan pH 5.5 yang ditujukan untuk menjaga kulit wajah bayi agar tetap lembab dan halus. Krim ini mengandung Panthenol yang dapat membantu mengurangi iritasi kulit.**Krim wajah yang dapat membantu mencegah iritasi pada kulit sekitar mulut bayi agar tidak kering, sehingga tampak lebih lembab dan kulit tampak lebih halus.**Oleskan tipis-tipis secukupnya disudut-sudut mulut bila terjadi peradangan / inflamasi di sekitar mulut.**Produk Konsumen**Box, Botol @ 50 ml**Sebapharma**BPOM: NC16140102097"
270,Sebamed Children's Shampoo 150 ml,Rp108.200 - Rp185.700,Indikasi Umum**Komposisi**Aturan Pakai**Golongan Produk**Kemasan**Manufaktur**No. Registrasi,"Untuk membersihkan dan menjaga rambut halus bayi serta kulit kepala bayi yang sensitif.**Air, Cocamidopropyl Betaine, Sodium Methyl Cocoyl Taurate, Disodium Cocamphodiacetate, Chamomilla Recutita (Matricaria) Flower Extract, Sodium Lactate, Coco Glucoside, Glyceryl Oleate, Sodium Laureth Sulfate, PEG 3 Distearate, PEG 150 Distearate, Laureth 2, Alcohol, Fragrance, Benzyl Alcohol, Phenoxyethanol, Sodium Benzoate.**Gunakan sampo secukupnya pada telapak tangan Anda. Sampokan ke kepala bayi dengan lembut. Bilas dengan baik hingga bersih**Produk Konsumen**Botol 150 ml X 1**Sebapharma**BPOM: NC16121001935"
271,Sebamed Childrens Shampoo 250 ml,Rp100.800 - Rp238.300,Golongan Produk**Kemasan**Manufaktur**No. Registrasi,"Produk Konsumen**Dus, Botol 250 ml**None**BPOM: NC16121001935"
272,Sudocrem Baby Care Cream 125 G,Rp102.000 - Rp169.600,Golongan Produk**Kemasan**Manufaktur,"Produk Konsumen**Dus, Pot @ 125 gram**Actavis"
273,Suu Balm Kids Head to Toe Wash 840 ml,Rp345.400 - Rp388.100,Deskripsi**Indikasi Umum**Komposisi**Dosis**Aturan Pakai**Perhatian**Golongan Produk**Kemasan**Manufaktur**No. Registrasi,"Suu Balm Kids Head to Toe Wash merupakan sabun mandi (body wash) dari Suu Balm untuk anak dengan formula yang lembut karena bebas dari kandungan sulfat, pewangi, paraben, dan krim bebas pengawet. Selain cocok untuk kulit kering dan sensitif, Suu Balm Kids Body Wash juga cocok untuk semua tipe kulit si kecil.**Sabun mandi (body wash) dari Suu Balm untuk anak dengan formula yang lembut karena bebas dari kandungan sulfat, pewangi, paraben, dan krim bebas pengawet**Water, Cetyl Alcohol, Butylene Glycol, Sodium Lauroyl Methyl Isethionate, Stearyl Alcohol, Hydroxyacetophenone, Caprylic/Capric Triglyceride, Caprylyl Glycol, Lactic Acid, Butyrospermum Parkii (Shea Butter), Betaine, Sodium Hyaluronate**Sesuai kebutuhan**1. Gunakan saat mandi atau mandi, setiap hari atau jika diperlukan. 2. Oleskan ke tubuh untuk membersihkan secara lembut, lalu bilas dengan air mengalir. 3. Jangan gunakan produk ini jika anak Anda alergi terhadap salah satu bahan. 4. Untuk hasil terbaik, jaga agar waktu mandi anak Anda singkat dan jangan gunakan air yang terlalu panas. 5. Setelah mandi, tepuk-tepuk kulit hingga kering dan aplikasikan Suu Balm Kids Moisturiser ke tubuh si kecil secara merata.**1. Hentikan pemakaian jika terjadi alergi atau tidak cocok terhadap salah satu bahan yang terdapat di produk ini. 2. Simpan di tempat sejuk dan terhindari dari paparan sinar matahari. 3. Hanya untuk penggunaan luar dan hindari terkena mata.**Produk Konsumen**Botol @ 840 ml**WICAKSANA OVERSEAS INTERNATIONAL**BPOM: NA32190705011"
274,Tresnojoyo Balsem Telon 20 g,Rp9.500 - Rp10.900,Deskripsi**Indikasi Umum**Komposisi**Dosis**Aturan Pakai**Golongan Produk**Kemasan**Manufaktur**No. Registrasi,"Tresnojoyo Balsem Telon membantu menghangatkan tubuh sekaligus melegakan hidung tersumbat akibat gejala pilek dan batuk pada anak.**Mencegah dan mengobati masuk angin dan perut kembung pada bayi dan anak, juga dapat digunakan untuk ibu dan anak, juga dapat digunakan untuk ibu setelah melahirkan. Mengatasi rasa gatal dan mencegah terjadinya iritasi serta keinginan untuk menggaruk. Melegakan pernafasan karena hidung tersumbat, batuk, flu dan pilek. Meringankan sakit kepala.**Aqua , Dibutyl Adipate , octocrylene , TitanIUm Dioxide , C12 - 15 Alkil Benzoat , gliserin , Dimethicone , butyl methoxydibenzoylmethane, Dietilamino Hydroxybenzoyl Hexyl Benzoat , PVP / Eicosene Copolymer , Panthenol , Bis - Ethylhexyloxyphenol Methoxyphenyl Triazine , mikrokristalin Selulosa , Lauryl glucoside , cetearyl Alkohol , Cetyl palmitat , Cocoglycerides , diethylhexyl Butamido Triazone , gliseril Stearate , Tokoferil Asetat , Phenoxyethanol , SodIUm Sulfat cetearyl , Polyglyceryl - 2 Dipolyhydroxystearate , Silica , Benzyl Alcohol , Selulosa gum , Parfum , Xanthan gum , sorbat Acid , Ethylhexylglycerin , DisodIUm EDTA , Asam Dehydracetic , Inulin , Lecithin**Sesuai kebutuhan**Hirupkan dan oleskan penghangat lembut Balsem Telon TRESNO JOYO pada dada dan punggung sebelum tidur, membuat anak Anda tidur lebih nyenyak.**Produk Konsumen**Dus, pot plastik @ 20 gram**Ultrasakti**BPOM: QD123711141"
275,Tresnojoyo Balsem Telon 40 g,Rp16.300 - Rp19.700,Deskripsi**Indikasi Umum**Komposisi**Dosis**Aturan Pakai**Perhatian**Golongan Produk**Kemasan**Manufaktur**No. Registrasi,"TRESNO JOYO BALSEM TELON merupakan balsem yang digunakan untuk meringankan gejala pilek dan batuk karena flu untuk bayi dan anak.**Meringankan gejala pilek dan batuk karena flu untuk bayi dan anak.**Metil Salisilat 30%, Menthol 18,5%, Camphor 12,5%, Ekstrak Jahe Merah 0,1%**Sesuai kebutuhan**Hirupkan dan oleskan penghangat lembut Balsem Telon TRESNO JOYO pada dada danpunggung sebelum tidur, membuat anak Anda tidur lebih nyenyak.**Simpan di tempat kering, terlindung dari sinar matahari langsung, pada suhu dibawah 30 C**Produk Konsumen**Pot @ 40 g**Ultrasakti**BPOM: QD123711141"
276,Vaseline Repairing Jelly Baby 50 ml,Rp30.200 - Rp49.500,Indikasi Umum**Dosis**Aturan Pakai**Perhatian**Golongan Produk**Kemasan**Manufaktur**No. Registrasi,Membantu melembabkan kulit dan mencegah kulit bayi menjadi kering.**Balsam**Oleskan pada bagian yang diinginkan**Hanya untuk pemakaian luar**Produk Konsumen**Pot @ 50 ml**Unilever**BPOM: NA49200100068
277,Watsons Gentle Baby Bath 500 ml,Rp38.100 - Rp60.900,Indikasi Umum**Komposisi**Aturan Pakai**Golongan Produk**Kemasan**Manufaktur,Produk untuk bayi dan anak dari Watsons yang dapat melindungi dan merawat kulit bayi dengan baik**Aqua Sodium Laureth Sodium Chloride Cocamide DEA Phenoxyethanol Sodium Benzoate Parfum PEG250 Distearate Citric Acid Benzophenone4 Disodium EDTA PEG40 Hydrogenated Castor Oil Butyl Methoxydibenzoylmethane Citrus Sinensis Fruit Water Butylene Glycol Terminalia Ferdinandiana Fruit Extract Alcohol Denat Limonene Hexyl Cinnamal Linalool**Tuangkan secukupnya baby bath ke telapak tangan atau spons mandi busakan Basuhkan ke seluruh tubuh bayi lalu bilas dengan air hingga bersih**Produk Konsumen**Botol @ 500 ml**Watson
278,Watsons Gentle Baby Shampoo 500 ml,Rp49.900,Indikasi Umum**Komposisi**Aturan Pakai**Golongan Produk**Kemasan**Manufaktur,Untuk mepertahankan kelembaban pada kulit kepala bayi anda karena mengandung Minyak Zaitun dan ekstrak biji gandum Rambut bayi Anda akan sehat dan bercahaya dengan aroma yang menyegarkan**Aqua Ammonium Lauryl Sulfate Cocamidopropyl Betaine Sodium Cocoamphoacetate Cocamide MEA Polyquaternium7 Sodium Chloride Parfum C1215 Pareth12 CocoGlucoside Glyyceryl Oleate Tetrasodium EDTA Citric Acid Triticum Vulgare Wheat Germ Extract Olea Europaea Olive Fruit Oil Methylchloroisothiazolinone Methylistothiazolinone CI 19140 CI 15985**Tuang Shampoo Bayi ini secukupnya ke telapak tangan anda gunakan pada rambut basah hingga permukaan kulit kepala Bilas dengan air secara perlahan**Produk Konsumen**Botol @ 500 ml**Watson
279,Zwitsal Baby Bath Classic 300 ml,Rp20.200 - Rp45.000,Golongan Produk**Kemasan**Manufaktur,Produk Konsumen**Botol @ 300 ml**Unilever
280,Zwitsal Baby Bath Classic 450 ml,Rp30.300 - Rp56.500,Indikasi Umum**Komposisi**Aturan Pakai**Perhatian**Kontra Indikasi**Efek Samping**Golongan Produk**Kemasan**Manufaktur,-**-**-**-**-**-**Produk Konsumen**-**Unilever
281,Zwitsal Baby Bath Natural with Minyak Telon 200 ml,Rp17.800 - Rp30.500,Golongan Produk**Kemasan**Manufaktur,Produk Konsumen**Botol @ 200 ml**Unilever
282,Zwitsal Baby Bath Natural with Rich Honey 300 ml,Rp22.300 - Rp45.100,Golongan Produk**Kemasan**Manufaktur,Produk Konsumen**Botol @ 300 ml**Unilever
283,Zwitsal Baby Bath Natural with Rich Honey Refill 450 ml,Rp29.200 - Rp50.500,Deskripsi**Indikasi Umum**Dosis**Aturan Pakai**Kontra Indikasi**Golongan Produk**Kemasan**Manufaktur**No. Registrasi,"Zwitsal Baby Bath Natural with Rich Honey merupakan sabun cair dengan kandungan Susu dan Madu untuk membersihkan dan menutrisi kulit serta menjaga kulit si kecil tetap halus dan terlihat segar. Bahan alami susu ini menjaga kulit bayi yang sensitif tetap terjaga dengan baik dan nyaman. Formula pH balanced yang membersihkan kulit dengan lembut, serta teruji hypo-allergenic sehingga dapat digunakan pada kulit sensitif.**Membersihkan tubuh si kecil secara menyeluruh, menutrisi dan melembutkan kulit, menjaga kulit tubuh tetap bersih dan sehat, melindungi kulit tubuh dari kuman.**Sesuai kebutuhan**1. Basahi rambut dan kulit si kecil secara perlahan. 2. Tuang secukupnya dan usapkan secara lembut mulai dari kepala hingga badan. 3. Bilas dengan air, lalu keringkan menggunakan handuk.**Hanya untuk pemakaian luar**Produk Konsumen**Pouch @ 450 ml**Unilever**BPOM: NA18180700943"
284,Zwitsal Baby Classic Cologne Fresh Day 100 ml,Rp16.500 - Rp29.100,Golongan Produk**Kemasan**Manufaktur,Produk Konsumen**Botol @ 100 ml**Unilever
285,Zwitsal Baby Cologne Natural Soft Touch 100 ml,Rp12.000 - Rp31.100,Golongan Produk**Kemasan**Manufaktur,Produk Konsumen**Botol @ 100 ml**Unilever
286,Zwitsal Baby Cream Extra Care With Zinc 50 ml,Rp13.200 - Rp27.500,Deskripsi**Indikasi Umum**Komposisi**Dosis**Aturan Pakai**Perhatian**Golongan Produk**Kemasan**Manufaktur**No. Registrasi,"Zwitsal Baby Cream Extra Care, krim dual action dengan formula lembut yang diperkaya dengan zinc & allantoin untuk meredakan dan mencegah tanda iritasi ringan akibat pemakaian popok serta menyejukan kulit. Dilengkapi dengan Canola oil, vitamin E dan moisturizer yang dapat menutrisi dan melembabkan kulit yang sensitif.**meredakan dan mencegah tanda iritasi ringan akibat pemakaian popok serta menyejukan kulit, dan menutrisi, melembabkan kulit yang sensitif.**Zinc & Allantoin, Vitamin E, Canola Oil**Sesuai kebutuhan**Usapkan dengan lembut pada area kuliy yang terkena popok, sebelum pemakaian popok bayi. Dapat digunakan juga untuk area lipatan agar menjaga kelembaban kulit.**Hanya untuk pemakaian luar.**Produk Konsumen**tube, 50 ml**Unilever**BPOM: NA18130103556"
287,Zwitsal Baby Hair Lotion Natural Aloe Vera Kemiri Seledri 100 ml,Rp22.200 - Rp36.200,Deskripsi**Indikasi Umum**Dosis**Aturan Pakai**Kontra Indikasi**Golongan Produk**Kemasan**Manufaktur**No. Registrasi,"Zwitsal Baby Hair Lotion Natural Aloe Vera Kemiri Seledri merupakan Lotion untuk rambut dengan kandungan aloe vera, kemiri, seledri yang membantu pertumbuhan rambut bayi hingga tampak tebal dan hitam. Bahan alaminya sudah teruji menutrisi rambut bayi tetap sehat dan harum sehingga tetap segar sepanjang hari. Lotion ini teruji hypo-allergenic, baik untuk digunakan kulit bayi yang sensitif sekalipun.**Membantu pertumbuhan rambut agar tampak hitam dan tebal serta membantu melindungi kulit kepala dari kekeringan.**Sesuai kebutuhan**1. Keringkan kulit kepala si kecil. 2. Oleskan perlahan sambil diberi pijatan lembut. 3. Gunakan rutin untuk hasil yang lebih maksimal.**Hanya untuk pemakaian luar.**Produk Konsumen**Botol @ 100 ml**Unilever**BPOM: NA18131003840"
288,Zwitsal Baby Hair Lotion Natural Aloe Vera Kemiri Seledri 200 ml,Rp24.900 - Rp57.500,Indikasi Umum**Golongan Produk**Kemasan**Manufaktur,Membantu rambut bayi untuk tetap tebal dan hitam**Produk Konsumen**Pack 200 ml**Unilever
289,Zwitsal Baby Shampoo Classic 100 ml,Rp8.500 - Rp22.500,Golongan Produk**Kemasan**Manufaktur,Produk Konsumen**Botol @ 100 ml**Unilever
290,Zwitsal Baby Shampoo Natural with Aloe Vera Kemiri Seledri 100 ml,Rp8.800 - Rp20.700,Golongan Produk**Kemasan**Manufaktur,Produk Konsumen**Botol @ 100 ml**Unilever
291,Zwitsal Baby Shampoo Natural with Aloe Vera Kemiri Seledri 200 ml,Rp15.000 - Rp26.900,Golongan Produk**Manufaktur,Produk Konsumen**Unilever
292,Zwitsal Baby Shampoo Natural with Aloe Vera Kemiri Seledri 300 ml,Rp28.400 - Rp60.500,Golongan Produk**Kemasan**Manufaktur,Produk Konsumen**Botol @ 300 ml**Unilever
293,Zwitsal Baby Shampoo Natural with Aloe Vera Kemiri Seledri 450 ml,Rp24.900 - Rp53.500,Golongan Produk**Kemasan**Manufaktur,Produk Konsumen**Pack 450 ml**Unilever
294,Zwitsal Baby Skin Protector Lotion 100 ml,Rp17.300 - Rp41.800,Deskripsi**Indikasi Umum**Komposisi**Dosis**Aturan Pakai**Perhatian**Kontra Indikasi**Efek Samping**Golongan Produk**Kemasan**Manufaktur,"ZWITSAL SKIN PROTECTOR LOTION merupakan lotion yang digunakan untuk mencegah dan mengatasi masalah iritasi pada kulit bayi seperti ruam popok dan biang keringat. Lotion ini juga dilengkapi dengan ekstrak Citronella sehingga dapat digunakan untuk melindungi bayi dari gigitan nyamuk.**lotion khusus bayi untuk menjaga kelembaban bayi dan dapat menyejukkan kulit yang memerah karena gatal.**100% minyak Citronella, ekstrak Chamomile**Sesuai kebutuhan**Oleskan pada bagian tubuh yang memerlukan**untuk pemakaian luar**-**-**Produk Konsumen**Botol @ 100 ml**Unilever"
295,Zwitsal Baby Skin Protector Lotion 50 ml,Rp12.700 - Rp21.900,Deskripsi**Indikasi Umum**Komposisi**Dosis**Aturan Pakai**Perhatian**Kontra Indikasi**Efek Samping**Golongan Produk**Kemasan**Manufaktur,"-**lotion khusus bayi untuk menjaga kelembaban bayi dan dapat menyejukkan kulit yang memerah karena gatal.**100% minyak Citronella, ekstrak Chamomile**sesuai kebutuhan**Oleskan pada bagian tubuh yang memerlukan**untuk pemakaian luar**-**-**Produk Konsumen**Tube 50 ml**Unilever"
